index,destination,lat,lon,dt,temp,pressure,description,Link,House,Description,Score
1,Mont Saint Michel,48.6359541,-1.511459954959514,1650540192,289.54,1008,overcast clouds,https://www.booking.com#basiclayout,Hôtel Vert,"Situé à 2 km du Mont-Saint-Michel, sur la côte normande, l'Hôtel Vert propose des chambres décorées dans des tons pastel dotées d'une salle de bains privative, d'une télévision ainsi que d'une...","8,1"
2,St Malo,48.649518,-2.0260409,1650540192,289.44,1008,few clouds,https://www.booking.com#basiclayout,Hotel Eden,"À 100 mètres de la plage, le charmant établissement Hotel Eden bénéficie d'un accès direct à la vieille ville et au palais des congrès. Il propose des chambres confortables. ","7,3"
3,Bayeux,49.2764624,-0.7024738,1650540192,290.29,1009,overcast clouds,https://www.booking.com#basiclayout,ibis budget Bayeux,Établissement Voyage Durable,"8,2"
4,Le Havre,49.4938975,0.1079732,1650540192,291.66,1009,overcast clouds,https://www.booking.com#basiclayout,Holiday Inn Express - Le Havre Centre,"L’Holiday Inn Express - Le Havre Centre, situé dans le centre-ville du Havre et à 600 mètres de la gare SNCF, vous accueille pour un séjour professionnel et de loisirs. ","8,2"
5,Rouen,49.4404591,1.0939658,1650540193,291.36,1008,clear sky,https://www.booking.com#basiclayout,"Radisson Blu Hotel, Rouen Centre","Situé à Rouen, le Radisson Blu Hotel, Rouen Centre dispose d'un restaurant servant des plats locaux de haute qualité, d'une salle de sport, d'un bar et d'un salon commun. ","8,9"
6,Paris,48.8588897,2.3200410217200766,1650540193,291.02,1007,clear sky,https://www.booking.com#basiclayout,L'Empire Paris,Établissement Voyage Durable,"8,2"
7,Amiens,49.8941708,2.2956951,1650540193,290.91,1010,few clouds,https://www.booking.com#basiclayout,"Holiday Inn Express Amiens, an IHG Hotel","Rénové en avril 2015, le Holiday Inn Express Amiens comprend des chambres confortables avec une connexion Wi-Fi gratuite. ","8,1"
8,Lille,50.6365654,3.0635282,1650540193,290.73,1009,clear sky,https://www.booking.com#basiclayout,Hotel Lille Europe,"L'Hotel Lille Europe est un établissement 3 étoiles situé au cœur du quartier des affaires international, à seulement 250 mètres de la gare de Lille-Flandres et à 17 minutes de route du stade...","8,1"
9,Strasbourg,48.584614,7.7507127,1650540193,290.07,1008,clear sky,https://www.booking.com#basiclayout,City Residence Access Strasbourg,"Situé à Strasbourg, à moins de 900 mètres du marché de Noël de la ville, le City Residence Access Strasbourg propose des hébergements avec une télévision et une kitchenette. ","7,1"
10,Chateau du Haut Koenigsbourg,48.249489800000006,7.34429620253195,1650540193,286.29,1007,clear sky,https://www.booking.com#basiclayout,Les Chambres du Haut-Koenigsbourg,"Situé à Orschwiller, en Alsace, l'établissement Les Chambres du Haut-Koenigsbourg propose des hébergements avec connexion Wi-Fi et parking privé gratuits. ","8,8"
11,Colmar,48.0777517,7.3579641,1650540193,289.57,1007,clear sky,https://www.booking.com#basiclayout,Le Parc - Standing apartments in front of the Champ de Mars,"Offrant une vue sur la ville et doté d'une connexion Wi-Fi gratuite, l'établissement Le Parc - Standing apartments in front of the Champ de Mars propose des hébergements idéalement situés dans le...","9,2"
12,Eguisheim,48.0447968,7.3079618,1650540193,289.48,1007,clear sky,https://www.booking.com#basiclayout,James Vignoble Hôtel - Eguisheim,Le James Vignoble Hôtel - Eguisheim vous accueille en plein cœur du vignoble d'Eguisheim. Il offre une vue spectaculaire sur la Forêt-Noire. ,"8,8"
13,Besancon,47.2380222,6.0243622,1650540193,290.61,1005,overcast clouds,https://www.booking.com#basiclayout,Hôtel AKENA BESANCON,"Situé à Besançon, à 7 km du parc Micropolis, l'Hôtel AKENA BESANCON propose un restaurant, un parking privé gratuit, un bar et une terrasse. ","8,7"
14,Dijon,47.3215806,5.0414701,1650540193,289.95,1005,clear sky,https://www.booking.com#basiclayout,Hôtel Restaurant initial by balladins Dijon Nord,"Situé à 12 minutes en voiture du centre-ville de Dijon, l'Hôtel Balladins Dijon Nord possède des chambres climatisées avec connexion Wi-Fi gratuite, des salles de réunion et un restaurant. ","7,6"
15,Annecy,45.8992348,6.1288847,1650540194,289.55,1004,clear sky,https://www.booking.com#basiclayout,Best Western Hotel International,"Doté d'une salle de sport avec un hammam et un jacuzzi, le Best Western Hotel International est situé à l'entrée d'Annecy, à 2 km du lac d'Annecy et du centre-ville. ","8,1"
16,Grenoble,45.1875602,5.7357819,1650540194,289.32,1004,overcast clouds,https://www.booking.com#basiclayout,Esprit Bistrot / Rent4night Grenoble,Hébergement géré par un particulier,"8,2"
17,Lyon,45.7578137,4.8320114,1650540194,291.51,1004,clear sky,https://www.booking.com#basiclayout,MEININGER Hotel Lyon Centre Berthelot,"Installé à Lyon, le MEININGER Hotel Lyon Centre Berthelot propose un bar, un parking privé, un salon commun et une terrasse. ","8,4"
18,Gorges du Verdon,43.7496562,6.3285616,1650540194,285.81,1001,broken clouds,https://www.booking.com#basiclayout,Hotel Le Panoramic,"Installé à 700 mètres du village de la Palud-sur-Verdon, l’Hotel Le Panoramic vous propose des chambres au sein d’un domaine de 4 hectares, au cœur du parc naturel régional du Verdon. ","7,8"
19,Bormes les Mimosas,43.1572172,6.329253867921363,1650540194,289.54,1002,broken clouds,https://www.booking.com#basiclayout,HomeStay Bormes,"Offrant une vue sur sa piscine, le HomeStay Bormes est situé à Bormes-les-Mimosas, à 5 km de La Favière. Vous bénéficierez gratuitement d'une connexion Wi-Fi et d'un parking privé. ","9,7"
20,Cassis,43.2140359,5.5396318,1650540194,290.57,1002,overcast clouds,https://www.booking.com#basiclayout,UNE TERRASSE SUR LA MER 4 pers 2 chambres VUE MER,"Situé à Cassis, à seulement 100 mètres de Bestouan, l'établissement UNE TERRASSE SUR LA MER 4 pers 2 chambres VUE MER propose un hébergement en bord de mer avec une terrasse et une connexion Wi-Fi...","8,7"
21,Marseille,43.2961743,5.3699525,1650540194,291.33,1002,broken clouds,https://www.booking.com#basiclayout,Maisons du Monde Hôtel & Suites - Marseille Vieux Port,"Surplombant le Vieux-Port, l’établissement Maisons du Monde Hôtel & Suites - Marseille Vieux Port vous accueille au cœur de Marseille. Il propose des chambres modernes et climatisées. ","8,4"
22,Aix en Provence,43.5298424,5.4474738,1650540194,289.83,1002,overcast clouds,https://www.booking.com#basiclayout,TheCamp Hotel&Lodges - Aix en Provence,Établissement Voyage Durable,"8,5"
23,Avignon,43.9492493,4.8059012,1650540195,289.61,1004,scattered clouds,https://www.booking.com#basiclayout,Maison XIXe et Jardin en Intramuros,Hébergement géré par un particulier,"9,1"
24,Uzes,44.0121279,4.4196718,1650540195,288.55,1004,overcast clouds,https://www.booking.com#basiclayout,Hôtel Le Saint-Geniès,"Cet hôtel à la gestion familiale est situé au cœur d'un jardin, dans un quartier résidentiel paisible à 1,5 km du centre historique d'Uzès. ","8,9"
25,Nimes,43.8374249,4.3600687,1650540195,289.28,1004,broken clouds,https://www.booking.com#basiclayout,ibis budget Nimes Centre Gare,"Situé à seulement 50 mètres de la gare de Nîmes, l'ibis Budget Nîmes Centre Gare vous propose une réception ouverte 24h/24, une bagagerie et une connexion Wi-Fi gratuite dans l'ensemble de...","8,0"
26,Aigues Mortes,43.5658225,4.1912837,1650540195,289.0,1004,overcast clouds,https://www.booking.com#basiclayout,Maison des Croisades,"Située à Aigues-Mortes, la Maison des Croisades propose un service de location de vélos et un jardin. Il dispose d'une connexion Wi-Fi gratuite et d'une terrasse. ","8,9"
27,Saintes Maries de la mer,43.4522771,4.4287172,1650540195,289.58,1004,light rain,https://www.booking.com#basiclayout,Mas De Calabrun,"Doté d’une piscine extérieure, d’un terrain de pétanque et d’une table de ping-pong, l’hôtel Mas De Calabrun est installé sur un domaine privé à Saintes-Maries-de-la-Mer, dans le Parc naturel régional...","8,6"
28,Collioure,42.52505,3.0831554,1650540195,285.69,1005,overcast clouds,https://www.booking.com#basiclayout,Le Mas des Citronniers,"Situé dans le centre de Collioure, à seulement 250 mètres de la plage, le Mas des Citronniers propose des chambres climatisées dans un bâtiment traditionnel catalan. ","8,0"
29,Carcassonne,43.2130358,2.3491069,1650540195,283.93,1007,light rain,https://www.booking.com#basiclayout,Domaine Le Couvent,Établissement Voyage Durable,"9,3"
30,Ariege,42.9455368,1.4065544156065486,1650540195,278.22,1010,overcast clouds,https://www.booking.com#basiclayout,dtente sky lodge,Hébergement géré par un particulier,"9,4"
31,Toulouse,43.6044622,1.4442469,1650540195,283.74,1008,overcast clouds,https://www.booking.com#basiclayout,Odalys City Toulouse Centre Compans Caffarelli,Établissement Voyage Durable,"8,7"
32,Montauban,44.0175835,1.3549991,1650540196,283.39,1007,overcast clouds,https://www.booking.com#basiclayout,Brit Hotel Confort Montauban,"Le Brit Hotel Confort Montauban est situé au sud de la ville de Montauban, à 300 mètres de la sortie 66 de l'autoroute A20. ","7,5"
33,Biarritz,43.4832523,-1.5592776,1650540196,284.52,1009,light rain,https://www.booking.com#basiclayout,"HYPER CENTRE, VUE MER ,APPARTEMENT NEUF, 6 adultes",Hébergement géré par un particulier,"9,4"
34,Bayonne,43.4933379,-1.475099,1650540196,284.57,1009,light rain,https://www.booking.com#basiclayout,Villa la Renaissance,"La Villa la Renaissance propose des chambres à Bayonne, à 600 mètres du parc Ansot et à 1,2 km de la cathédrale Sainte-Marie. Il propose un service d'étage et une terrasse. ","9,2"
35,La Rochelle,46.1591126,-1.1520434,1650540196,291.22,1007,clear sky,https://www.booking.com#basiclayout,Maisons du Monde Hôtel & Suites - La Rochelle Vieux Port,"L’établissement Maisons du Monde Hôtel & Suites - La Rochelle Vieux Port vous accueille dans la ville de La Rochelle, sur le vieux port. ","8,4"
